{
  "schemaVersion": "1.0.0",
  "version": 1,
  "sceneId": "product-farm",
  "name": "Riose Product Farm",
  "world": {
    "unit": "cell",
    "width": 34,
    "height": 16,
    "tile": {"width": 26, "height": 14},
    "origin": {"x": 283, "y": 32},
    "soilDepth": 18
  },
  "outline": [
    [0, 3], [2, 1], [5, 0], [12, 0], [15, 1], [19, 0], [29, 0], [32, 1], [34, 3],
    [33, 5], [34, 7], [33, 9], [34, 12], [32, 14], [29, 15], [24, 16], [18, 15],
    [13, 16], [8, 15], [4, 16], [1, 14], [0, 11], [1, 8], [0, 6]
  ],
  "zones": [
    {"id": "paddock-a", "kind": "pasture", "patch": 0, "x": 1, "y": 1, "w": 6, "h": 4},
    {"id": "paddock-b", "kind": "pasture", "patch": 1, "x": 8, "y": 1, "w": 6, "h": 4},
    {"id": "paddock-c", "kind": "pasture", "patch": 2, "x": 1, "y": 6, "w": 6, "h": 4},
    {"id": "paddock-d", "kind": "pasture", "patch": 3, "x": 8, "y": 6, "w": 6, "h": 4},
    {"id": "working-pen", "kind": "holdingPen", "x": 20, "y": 8, "w": 8, "h": 6}
  ],
  "structures": [
    {"id": "farmstead", "kind": "farmstead", "x": 17, "y": 1, "w": 4, "h": 3, "asset": "building-farmhouse-imagegen-v1", "hero": true},
    {"id": "pond", "kind": "pond", "x": 24, "y": 2, "w": 3, "h": 2, "asset": "water-pond-imagegen-v1"},
    {"id": "barn-corral", "kind": "barnCorral", "x": 16, "y": 9, "w": 4, "h": 3, "asset": "building-shed-imagegen-v1", "hero": true},
    {"id": "crop-block", "kind": "crops", "x": 29, "y": 8, "w": 5, "h": 3, "asset": "field-soybean-growing"}
  ],
  "paths": [
    {"id": "main-lane", "destinations": ["farmstead"], "cells": [[7, 3], [7, 2], [7, 1], [7, 0], [8, 0], [9, 0], [10, 0], [11, 0], [12, 0], [13, 0], [14, 0], [14, 1], [14, 2], [14, 3], [15, 3], [15, 4], [16, 4]]},
    {"id": "south-lane", "cells": [[7, 8], [7, 9], [7, 10], [8, 10], [9, 10], [10, 10], [11, 10], [12, 10], [13, 10], [14, 10], [14, 9], [14, 8]]},
    {"id": "yard-connector", "destinations": ["barn-corral"], "cells": [[15, 4], [15, 5], [15, 6], [15, 7], [15, 8], [14, 8], [14, 9], [14, 10], [14, 11], [15, 10]]},
    {"id": "crop-connector", "destinations": ["pond", "crop-block"], "cells": [[16, 4], [17, 4], [18, 4], [19, 4], [20, 4], [21, 4], [22, 4], [23, 4], [23, 5], [23, 6], [23, 7], [24, 7], [25, 7], [26, 7], [27, 7], [28, 7]]}
  ],
  "gates": [
    {"id": "gate-a", "zone": "paddock-a", "a": {"x": 7, "y": 2}, "b": {"x": 7, "y": 3}, "connects": "main-lane"},
    {"id": "gate-b", "zone": "paddock-b", "a": {"x": 14, "y": 2}, "b": {"x": 14, "y": 3}, "connects": "main-lane"},
    {"id": "gate-c", "zone": "paddock-c", "a": {"x": 7, "y": 7}, "b": {"x": 7, "y": 8}, "connects": "south-lane"},
    {"id": "gate-d", "zone": "paddock-d", "a": {"x": 14, "y": 8}, "b": {"x": 14, "y": 9}, "connects": "south-lane"},
    {"id": "yard-gate", "zone": "working-pen", "a": {"x": 23, "y": 8}, "b": {"x": 24, "y": 8}, "connects": "crop-connector"}
  ],
  "vegetation": [
    {"id": "tree-north-west", "asset": "vegetation-tree-shade-imagegen-v1", "x": 1.6, "y": 2.8},
    {"id": "tree-north-west-inner", "asset": "vegetation-tree-shade-imagegen-v1", "x": 4, "y": 1.2},
    {"id": "tree-north-mid", "asset": "vegetation-tree-shade-imagegen-v1", "x": 11, "y": 0.4},
    {"id": "tree-north-east-inner", "asset": "vegetation-tree-shade-imagegen-v1", "x": 15, "y": 1.6},
    {"id": "tree-north-east", "asset": "vegetation-tree-shade-imagegen-v1", "x": 23, "y": 0.25},
    {"id": "tree-east-inner", "asset": "vegetation-tree-shade-imagegen-v1", "x": 30, "y": 1},
    {"id": "tree-east", "asset": "vegetation-tree-shade-imagegen-v1", "x": 32, "y": 3},
    {"id": "tree-west", "asset": "vegetation-tree-shade-imagegen-v1", "x": 1, "y": 12},
    {"id": "tree-south-west", "asset": "vegetation-tree-shade-imagegen-v1", "x": 7, "y": 14},
    {"id": "tree-south-mid", "asset": "vegetation-tree-shade-imagegen-v1", "x": 15, "y": 15},
    {"id": "tree-south-east-inner", "asset": "vegetation-tree-shade-imagegen-v1", "x": 25, "y": 14},
    {"id": "tree-east-south", "asset": "vegetation-tree-shade-imagegen-v1", "x": 31, "y": 11}
  ]
}
